project_short_title,milestone_title,task_title,task_description,task_type
Digital Govt,Service Inventory & Prioritization,Service Catalog Creation,Inventory all government services across departments,Task
Digital Govt,Service Inventory & Prioritization,Digital Readiness Assessment,Assess digitization feasibility for each service,Task
Digital Govt,Service Inventory & Prioritization,Citizen Demand Analysis,Analyze service usage volumes and citizen demand,Task
Digital Govt,Service Inventory & Prioritization,Prioritization Framework,Prioritize services using impact-effort matrix,Documentation
Digital Govt,User Research & Journey Mapping,Citizen Personas Development,Develop personas representing diverse citizen segments,Task
Digital Govt,User Research & Journey Mapping,Journey Mapping Workshops,Facilitate service journey mapping with stakeholders,Task
Digital Govt,User Research & Journey Mapping,Pain Point Analysis,Identify friction points and service improvement opportunities,Task
Digital Govt,User Research & Journey Mapping,Journey Maps Documentation,Create visual journey maps for priority services,Documentation
Digital Govt,Digital Identity Framework,Identity Assurance Levels,Define identity assurance levels and authentication methods,Documentation
Digital Govt,Digital Identity Framework,Identity Provider Selection,Select federated identity provider solution,Task
Digital Govt,Digital Identity Framework,eID Integration,Integrate with national electronic ID infrastructure,Task
Digital Govt,Digital Identity Framework,Privacy Impact Assessment,Conduct privacy impact assessment for identity system,Documentation
Digital Govt,Core Platform Development,Platform Architecture Design,Design microservices-based digital services platform,Task
Digital Govt,Core Platform Development,Common Components Development,Build shared components for forms, payments and notifications,Task
Digital Govt,Core Platform Development,API Gateway Implementation,Implement API gateway for service integration,Task
Digital Govt,Core Platform Development,Design System Development,Develop government design system and UI components,Task
Digital Govt,Service Migration Phase 1,Service Digitization,Digitize priority services including licensing and permits,Task
Digital Govt,Service Migration Phase 1,Backend Integration,Integrate digital services with legacy backend systems,Task
Digital Govt,Service Migration Phase 1,User Acceptance Testing,Conduct UAT with citizens and government staff,Task
Digital Govt,Service Migration Phase 1,Soft Launch,Launch services to limited user group before full rollout,Task
Digital Govt,Mobile App Launch,Mobile App Development,Develop citizen services mobile application,Feature
Digital Govt,Mobile App Launch,Push Notification Service,Implement service status push notifications,Feature
Digital Govt,Mobile App Launch,Offline Capability,Enable offline form completion and submission,Feature
Digital Govt,Mobile App Launch,App Store Publication,Publish app to iOS App Store and Google Play,Task
Digital Govt,Accessibility Compliance,WCAG 2.1 AA Compliance,Ensure all services meet WCAG 2.1 Level AA standards,Task
Digital Govt,Accessibility Compliance,Screen Reader Testing,Test services with screen reader assistive technology,Task
Digital Govt,Accessibility Compliance,Keyboard Navigation,Ensure full keyboard navigation support,Task
Digital Govt,Accessibility Compliance,Accessibility Audit Report,Document accessibility compliance and remediation,Documentation
Digital Govt,Full Service Catalog,Remaining Service Digitization,Complete digitization of all remaining services,Task
Digital Govt,Full Service Catalog,Cross-Department Integration,Integrate services across multiple departments,Task
Digital Govt,Full Service Catalog,Citizen Feedback System,Implement service rating and feedback mechanism,Feature
Digital Govt,Full Service Catalog,Continuous Improvement Process,Establish process for ongoing service enhancement,Task
Tax System,Requirements Analysis,Stakeholder Requirements Gathering,Gather requirements from tax authority stakeholders,Task
Tax System,Requirements Analysis,Business Process Mapping,Map current tax collection and audit processes,Task
Tax System,Requirements Analysis,Gap Analysis,Identify gaps between current and desired capabilities,Task
Tax System,Requirements Analysis,Requirements Specification,Document functional and technical requirements,Documentation
Tax System,Tax Law Digitization,Tax Code Analysis,Analyze tax laws and calculation methodologies,Task
Tax System,Tax Law Digitization,Business Rules Definition,Translate tax laws into system business rules,Documentation
Tax System,Tax Law Digitization,Tax Calculation Engine,Develop configurable tax calculation engine,Task
Tax System,Tax Law Digitization,Rules Testing & Validation,Validate tax calculations against test scenarios,Task
Tax System,Taxpayer Portal Design,Portal UX Design,Design intuitive taxpayer self-service portal,Task
Tax System,Taxpayer Portal Design,Registration & Profile Management,Build taxpayer registration and profile management,Task
Tax System,Taxpayer Portal Design,Tax Calculator Tools,Provide interactive tax estimation calculators,Feature
Tax System,Taxpayer Portal Design,Secure Messaging,Implement secure messaging with tax authority,Feature
Tax System,E-Filing System Development,Digital Forms Engine,Build dynamic tax form rendering engine,Task
Tax System,E-Filing System Development,Prepopulation & Auto-Fill,Implement form prepopulation from prior returns,Feature
Tax System,E-Filing System Development,Attachment Upload,Enable secure document upload and virus scanning,Task
Tax System,E-Filing System Development,Electronic Signature,Implement qualified electronic signature capability,Feature
Tax System,Payment Gateway Integration,Payment Method Support,Support credit/debit cards, bank transfers and e-wallets,Feature
Tax System,Payment Gateway Integration,Payment Gateway Certification,Obtain PCI DSS compliance certification,Task
Tax System,Payment Gateway Integration,Installment Plan Management,Enable taxpayers to setup payment installment plans,Feature
Tax System,Payment Gateway Integration,Receipt Generation,Generate and deliver digital payment receipts,Task
Tax System,Audit & Compliance Module,Risk-Based Selection,Implement risk scoring for audit case selection,Feature
Tax System,Audit & Compliance Module,Audit Case Management,Build audit workflow and case management system,Task
Tax System,Audit & Compliance Module,Document Request & Response,Enable digital audit document exchange,Task
Tax System,Audit & Compliance Module,Assessment & Appeal Process,Digitize tax assessment and appeal procedures,Task
Tax System,Data Analytics & Fraud Detection,Data Warehouse Construction,Build tax data warehouse for analytics,Task
Tax System,Data Analytics & Fraud Detection,Revenue Forecasting Models,Develop predictive revenue forecasting models,Task
Tax System,Data Analytics & Fraud Detection,Fraud Detection Rules,Implement anomaly detection and fraud indicators,Feature
Tax System,Data Analytics & Fraud Detection,Third-Party Data Integration,Integrate employer reporting and financial institution data,Task
Tax System,Pilot Testing & Rollout,Pilot User Group Selection,Select diverse taxpayer group for pilot testing,Task
Tax System,Pilot Testing & Rollout,Pilot Launch & Monitoring,Launch pilot and monitor system performance,Task
Tax System,Pilot Testing & Rollout,Issue Resolution,Identify and resolve pilot testing issues,Bug
Tax System,Pilot Testing & Rollout,Phased Production Rollout,Execute phased rollout to all taxpayers,Task
Smart City,IoT Infrastructure Planning,IoT Architecture Design,Design citywide IoT sensor network architecture,Task
Smart City,IoT Infrastructure Planning,Communication Network Design,Design LoRaWAN or cellular IoT connectivity,Task
Smart City,IoT Infrastructure Planning,Data Platform Architecture,Design central IoT data platform and analytics,Task
Smart City,IoT Infrastructure Planning,Cybersecurity Framework,Define IoT security policies and controls,Documentation
Smart City,Traffic Management System,Traffic Sensor Deployment,Install intersection cameras and induction loops,Task
Smart City,Traffic Management System,Adaptive Signal Control,Implement adaptive traffic signal optimization,Feature
Smart City,Traffic Management System,Incident Detection,Deploy automated traffic incident detection,Feature
Smart City,Traffic Management System,Traffic Control Center,Build centralized traffic monitoring and control center,Task
Smart City,Environmental Monitoring,Air Quality Sensor Network,Deploy PM2.5 and NO2 air quality sensors,Task
Smart City,Environmental Monitoring,Noise Monitoring Stations,Install noise level monitoring at key locations,Task
Smart City,Environmental Monitoring,Weather Station Network,Deploy meteorological monitoring stations,Task
Smart City,Environmental Monitoring,Environmental Data Portal,Publish real-time environmental data publicly,Feature
Smart City,Public Transportation Integration,Real-Time Vehicle Tracking,Install GPS tracking on all transit vehicles,Task
Smart City,Public Transportation Integration,Transit App Development,Develop real-time transit information mobile app,Feature
Smart City,Public Transportation Integration,Electronic Ticketing,Implement contactless smart card transit payment,Feature
Smart City,Public Transportation Integration,Multi-Modal Journey Planning,Build integrated journey planner across modes,Feature
Smart City,Citizen Engagement App,City Services App,Develop citizen services super-app,Feature
Smart City,Citizen Engagement App,Issue Reporting,Enable citizens to report potholes and service issues,Feature
Smart City,Citizen Engagement App,Service Request Tracking,Provide transparency on request status and resolution,Task
Smart City,Citizen Engagement App,Civic Participation Tools,Include polling and community engagement features,Feature
Smart City,Energy Management,Smart Street Lighting,Deploy adaptive LED street lighting with dimming,Feature
Smart City,Energy Management,Municipal Building Automation,Implement BMS across government buildings,Task
Smart City,Energy Management,Renewable Energy Integration,Integrate solar and battery storage at facilities,Task
Smart City,Energy Management,Energy Dashboard,Build citywide energy monitoring dashboard,Task
Smart City,Waste Management Optimization,Smart Waste Bins,Deploy fill-level sensors in public waste bins,Task
Smart City,Waste Management Optimization,Route Optimization,Optimize waste collection routes using AI,Feature
Smart City,Waste Management Optimization,Fleet Management,Track and manage waste collection fleet,Task
Smart City,Waste Management Optimization,Recycling Analytics,Analyze recycling rates and contamination,Task
Smart City,Public Safety Integration,Video Surveillance Network,Expand city CCTV network with analytics,Task
Smart City,Public Safety Integration,Emergency Response Integration,Integrate with 911 dispatch and response systems,Task
Smart City,Public Safety Integration,Gunshot Detection,Deploy acoustic gunshot detection sensors,Feature
Smart City,Public Safety Integration,Public Safety Dashboard,Build real-time situational awareness dashboard,Task
Emergency Sys,Current System Assessment,System Capabilities Review,Document current 911 and dispatch system capabilities,Task
Emergency Sys,Current System Assessment,Interoperability Assessment,Assess current multi-agency coordination gaps,Task
Emergency Sys,Current System Assessment,Technology Obsolescence,Identify legacy systems requiring modernization,Task
Emergency Sys,Current System Assessment,Needs Assessment Report,Document requirements for next generation system,Documentation
Emergency Sys,Unified Communication Platform,NG911 Implementation,Implement Next Generation 911 IP-based infrastructure,Task
Emergency Sys,Unified Communication Platform,Text & Video 911,Enable text message and video 911 call intake,Feature
Emergency Sys,Unified Communication Platform,Automatic Location Identification,Enhance ALI accuracy for wireless and VoIP calls,Feature
Emergency Sys,Unified Communication Platform,Call Recording & Quality Management,Implement comprehensive call recording and QA,Task
Emergency Sys,Dispatch Optimization,Computer-Aided Dispatch Upgrade,Implement modern CAD system with mapping,Task
Emergency Sys,Dispatch Optimization,Recommendation Engine,Build AI-powered unit recommendation algorithms,Feature
Emergency Sys,Dispatch Optimization,Closest Unit Dispatching,Implement GPS-based closest available unit dispatch,Feature
Emergency Sys,Dispatch Optimization,Call Priority & Queuing,Optimize call triage and queuing algorithms,Task
Emergency Sys,Resource Management,Unit Status Tracking,Real-time tracking of all emergency unit status,Task
Emergency Sys,Resource Management,Vehicle & Equipment Management,Manage fleet and equipment inventory,Task
Emergency Sys,Resource Management,Personnel Scheduling,Optimize shift scheduling and overtime management,Task
Emergency Sys,Resource Management,Mutual Aid Coordination,Facilitate multi-jurisdiction mutual aid requests,Task
Emergency Sys,Multi-Agency Coordination,Interagency Data Sharing,Enable secure data sharing between agencies,Task
Emergency Sys,Multi-Agency Coordination,Unified Incident Management,Implement NIMS-compliant incident management,Task
Emergency Sys,Multi-Agency Coordination,Cross-Agency Radio Integration,Integrate P25 radio systems across agencies,Task
Emergency Sys,Multi-Agency Coordination,Joint Training Exercises,Conduct multi-agency training and exercises,Task
Emergency Sys,Mobile Command Center,Mobile Data Terminals,Deploy ruggedized MDTs in emergency vehicles,Task
Emergency Sys,Mobile Command Center,Mobile Application,Develop responder mobile app for incident info,Feature
Emergency Sys,Mobile Command Center,Offline Capability,Enable offline operation with auto-sync,Feature
Emergency Sys,Mobile Command Center,Electronic Patient Care Reporting,Implement ePCR for EMS documentation,Feature
Emergency Sys,Training & Simulation,Training Curriculum Development,Develop comprehensive system training curriculum,Documentation
Emergency Sys,Training & Simulation,Simulation Environment,Build realistic training simulation environment,Task
Emergency Sys,Training & Simulation,Dispatcher Training,Train 911 call takers and dispatchers,Task
Emergency Sys,Training & Simulation,Responder Training,Train first responders on mobile systems,Task
Emergency Sys,Live Deployment,Parallel Operations,Run new system parallel with legacy system,Task
Emergency Sys,Live Deployment,Cutover Execution,Execute controlled cutover to new system,Task
Emergency Sys,Live Deployment,Hypercare Support,Provide intensive post-launch support,Task
Emergency Sys,Live Deployment,Performance Monitoring,Monitor system performance and call handling metrics,Task
Public Health,Disease Surveillance System,Syndromic Surveillance,Implement real-time syndromic surveillance feeds,Feature
Public Health,Disease Surveillance System,Reportable Disease Registry,Build notifiable disease case reporting system,Task
Public Health,Disease Surveillance System,Healthcare Provider Integration,Integrate with hospital and clinic EHR systems,Task
Public Health,Disease Surveillance System,Surveillance Dashboard,Develop disease surveillance monitoring dashboard,Task
Public Health,Laboratory Information System,LIS System Implementation,Implement modern laboratory information system,Task
Public Health,Laboratory Information System,Specimen Tracking,Implement barcode-based specimen tracking,Feature
Public Health,Laboratory Information System,Test Result Reporting,Automate test result reporting to providers and health dept,Task
Public Health,Laboratory Information System,Quality Control Management,Implement lab QA/QC procedures and documentation,Task
Public Health,Outbreak Detection Algorithms,Baseline Modeling,Model historical disease baseline and seasonality,Task
Public Health,Outbreak Detection Algorithms,Anomaly Detection,Implement statistical outbreak detection algorithms,Feature
Public Health,Outbreak Detection Algorithms,Spatial Cluster Analysis,Detect geographic disease clusters using spatial statistics,Feature
Public Health,Outbreak Detection Algorithms,Early Warning Alerts,Configure automated outbreak alert notifications,Task
Public Health,Contact Tracing Platform,Case Investigation Module,Build digital case investigation and interview tools,Task
Public Health,Contact Tracing Platform,Contact Elicitation,Develop contact identification and exposure assessment,Task
Public Health,Contact Tracing Platform,Contact Notification,Implement secure contact notification system,Feature
Public Health,Contact Tracing Platform,Quarantine Monitoring,Track quarantine compliance and daily check-ins,Task
Public Health,Vaccination Management,Immunization Registry,Build comprehensive immunization information system,Task
Public Health,Vaccination Management,Vaccine Inventory Management,Track vaccine inventory and cold chain monitoring,Task
Public Health,Vaccination Management,Appointment Scheduling,Implement mass vaccination appointment system,Feature
Public Health,Vaccination Management,Digital Vaccination Cards,Issue digital vaccination credentials and certificates,Feature
Public Health,Health Data Warehouse,Data Integration Architecture,Integrate data from surveillance, labs and vital records,Task
Public Health,Health Data Warehouse,Master Person Index,Implement MPI for patient identity matching,Task
Public Health,Health Data Warehouse,Data Quality & Governance,Establish data quality rules and stewardship,Task
Public Health,Health Data Warehouse,Analytics Environment,Provide secure analytics workspace for epidemiologists,Task
Public Health,Public Dashboard,Public-Facing Dashboard,Build public COVID-19 or disease surveillance dashboard,Feature
Public Health,Public Dashboard,Data Visualization,Create intuitive charts and maps for public consumption,Task
Public Health,Public Dashboard,Mobile Optimization,Optimize dashboard for mobile device access,Task
Public Health,Public Dashboard,Automated Daily Updates,Automate daily data refresh and publication,Task
Public Health,International Reporting,WHO Reporting Integration,Implement WHO International Health Regulations reporting,Task
Public Health,International Reporting,Data Standardization,Map data to international standards like ICD-10,Task
Public Health,International Reporting,Automated Report Generation,Generate automated reports to WHO and CDC,Task
Public Health,International Reporting,Reporting Documentation,Document reporting methodologies and data quality,Documentation
E-Voting,Security Architecture Design,Threat Modeling,Conduct comprehensive election security threat modeling,Task
E-Voting,Security Architecture Design,Security Requirements,Define security requirements and controls,Documentation
E-Voting,Security Architecture Design,End-to-End Verifiability,Design architecture with end-to-end verifiable voting,Task
E-Voting,Security Architecture Design,Security Architecture Document,Document layered security architecture approach,Documentation
E-Voting,Blockchain Foundation,Blockchain Platform Selection,Evaluate and select permissioned blockchain platform,Task
E-Voting,Blockchain Foundation,Consensus Mechanism Design,Design Byzantine fault tolerant consensus for voting,Task
E-Voting,Blockchain Foundation,Smart Contract Development,Develop voting smart contracts with formal verification,Task
E-Voting,Blockchain Foundation,Blockchain Network Deployment,Deploy and configure blockchain voting network,Task
E-Voting,Voter Authentication System,Voter Registry Integration,Integrate with authoritative voter registration database,Task
E-Voting,Voter Authentication System,Multi-Factor Authentication,Implement strong multi-factor voter authentication,Feature
E-Voting,Voter Authentication System,Biometric Verification,Integrate facial recognition or fingerprint verification,Feature
E-Voting,Voter Authentication System,Credential Issuance,Issue cryptographic voting credentials to eligible voters,Task
E-Voting,Ballot Design & Interface,Ballot Definition Language,Implement flexible ballot markup and definition,Task
E-Voting,Ballot Design & Interface,User Interface Design,Design accessible and intuitive voting interface,Task
E-Voting,Ballot Design & Interface,Accessibility Features,Ensure compliance with voting accessibility requirements,Task
E-Voting,Ballot Design & Interface,Multi-Language Support,Support ballot presentation in multiple languages,Feature
E-Voting,Vote Encryption & Storage,End-to-End Encryption,Implement encryption from voter device to tallying,Task
E-Voting,Vote Encryption & Storage,Homomorphic Encryption,Enable encrypted vote aggregation without decryption,Feature
E-Voting,Vote Encryption & Storage,Vote Storage Protocol,Store encrypted votes on immutable blockchain,Task
E-Voting,Vote Encryption & Storage,Anonymization & Privacy,Ensure vote secrecy and unlinkability to voter identity,Task
E-Voting,Audit Trail & Verification,Voter-Verifiable Receipt,Generate encrypted receipt for voters to verify vote,Feature
E-Voting,Audit Trail & Verification,Independent Verification,Enable independent verification of election results,Feature
E-Voting,Audit Trail & Verification,Audit Log Management,Maintain comprehensive tamper-evident audit logs,Task
E-Voting,Audit Trail & Verification,Risk-Limiting Audit Support,Support statistical risk-limiting audit procedures,Task
E-Voting,Pilot Election,Pilot Election Planning,Plan low-stakes pilot election with controlled scope,Task
E-Voting,Pilot Election,Voter Education Campaign,Educate pilot voters on e-voting process,Task
E-Voting,Pilot Election,Pilot Election Execution,Conduct pilot election with monitoring,Task
E-Voting,Pilot Election,Pilot Evaluation Report,Evaluate pilot results and identify improvements,Documentation
E-Voting,Certification & Approval,Security Audit,Conduct independent security audit and penetration testing,Task
E-Voting,Certification & Approval,Certification Testing,Complete voting system certification testing,Task
E-Voting,Certification & Approval,Legal & Regulatory Approval,Obtain necessary legal and regulatory approvals,Documentation
E-Voting,Certification & Approval,Public Transparency Report,Publish transparency report on system security,Documentation
Border Ctrl,Biometric System Selection,Biometric Modality Evaluation,Evaluate fingerprint, facial recognition and iris scanning,Task
Border Ctrl,Biometric System Selection,Accuracy & Performance Testing,Test biometric accuracy across demographic groups,Task
Border Ctrl,Biometric System Selection,Vendor Selection,Select biometric system vendor through procurement,Task
Border Ctrl,Biometric System Selection,Privacy Impact Assessment,Assess privacy implications of biometric collection,Documentation
Border Ctrl,Database Infrastructure,Biometric Database Design,Design scalable biometric matching database,Task
Border Ctrl,Database Infrastructure,Traveler History Database,Build comprehensive traveler crossing history database,Task
Border Ctrl,Database Infrastructure,Watchlist Integration,Integrate with terrorism and criminal watchlists,Task
Border Ctrl,Database Infrastructure,Data Encryption & Security,Implement encryption and access controls for sensitive data,Task
Border Ctrl,Facial Recognition Integration,Facial Recognition Cameras,Deploy high-resolution facial recognition cameras,Task
Border Ctrl,Facial Recognition Integration,Live Face Matching,Implement real-time 1:1 facial biometric matching,Feature
Border Ctrl,Facial Recognition Integration,Photo Quality Assessment,Assess photo quality and re-capture if needed,Task
Border Ctrl,Facial Recognition Integration,Facial Recognition Accuracy Tuning,Tune matching thresholds for optimal accuracy,Task
Border Ctrl,Automated Border Gates,E-Gate Hardware Installation,Install automated border control e-gates,Task
Border Ctrl,Automated Border Gates,Document Reader Integration,Integrate optical and RFID passport readers,Task
Border Ctrl,Automated Border Gates,Self-Service User Interface,Design intuitive self-service traveler interface,Task
Border Ctrl,Automated Border Gates,Exception Handling Workflow,Define procedures for gate rejections and referrals,Documentation
Border Ctrl,Risk Assessment Engine,Risk-Based Screening,Implement risk-based passenger screening algorithms,Feature
Border Ctrl,Risk Assessment Engine,Advance Passenger Information,Integrate API data from airlines for pre-screening,Task
Border Ctrl,Risk Assessment Engine,Behavioral Analysis,Incorporate behavioral risk indicators in screening,Task
Border Ctrl,Risk Assessment Engine,Risk Score Validation,Validate risk model accuracy and bias testing,Task
Border Ctrl,Mobile Inspection Units,Mobile Device Procurement,Procure ruggedized tablets for mobile officers,Task
Border Ctrl,Mobile Inspection Units,Mobile Application Development,Develop mobile inspection officer application,Feature
Border Ctrl,Mobile Inspection Units,Offline Capability,Enable offline operation at remote border locations,Feature
Border Ctrl,Mobile Inspection Units,License Plate Recognition,Integrate mobile ALPR for vehicle screening,Feature
Border Ctrl,Training Program,Operator Training Curriculum,Develop comprehensive operator training program,Documentation
Border Ctrl,Training Program,System Training Delivery,Train border control officers on new systems,Task
Border Ctrl,Training Program,Scenario-Based Exercises,Conduct scenario-based training exercises,Task
Border Ctrl,Training Program,Certification Testing,Administer operator competency certification,Task
Border Ctrl,Airport Deployment,Airport Site Preparation,Prepare installation sites at international terminals,Task
Border Ctrl,Airport Deployment,System Installation,Install e-gates and biometric systems at airports,Task
Border Ctrl,Airport Deployment,Integration Testing,Test integration with airport and airline systems,Task
