project_short_title,milestone_title,task_title,task_description,task_type
Border Ctrl,Airport Deployment,Phased Airport Rollout,Roll out to airports in phases starting with busiest,Task
Open Data,Data Catalog Development,Data Asset Inventory,Inventory government datasets across all agencies,Task
Open Data,Data Catalog Development,Metadata Standards,Define metadata standards for dataset documentation,Documentation
Open Data,Data Catalog Development,Catalog Platform Selection,Select and implement open data catalog platform,Task
Open Data,Data Catalog Development,Dataset Registration,Register and document datasets in catalog,Task
Open Data,API Framework,API Design Standards,Define RESTful API design standards and guidelines,Documentation
Open Data,API Framework,API Gateway Deployment,Deploy API gateway for rate limiting and security,Task
Open Data,API Framework,Dataset APIs,Expose priority datasets through well-documented APIs,Feature
Open Data,API Framework,API Developer Portal,Build developer portal with API documentation,Task
Open Data,Data Quality Assessment,Data Quality Profiling,Profile data quality across government datasets,Task
Open Data,Data Quality Assessment,Quality Scoring,Score datasets on completeness, accuracy and timeliness,Task
Open Data,Data Quality Assessment,Data Remediation,Clean and improve data quality for publication,Task
Open Data,Data Quality Assessment,Quality Metadata,Publish data quality metadata with datasets,Documentation
Open Data,Anonymization & Privacy,Privacy Risk Assessment,Assess re-identification risks in datasets,Task
Open Data,Anonymization & Privacy,De-Identification Techniques,Apply k-anonymity and differential privacy techniques,Task
Open Data,Anonymization & Privacy,Privacy Review Process,Establish privacy review process for dataset releases,Documentation
Open Data,Anonymization & Privacy,Anonymization Tools,Develop automated anonymization tools and scripts,Task
Open Data,Visualization Tools,Data Visualization Platform,Implement data visualization and exploration tools,Task
Open Data,Visualization Tools,Interactive Dashboards,Build pre-configured dashboards for common datasets,Feature
Open Data,Visualization Tools,Embed Code Generation,Enable embedding of charts in external websites,Feature
Open Data,Visualization Tools,Mobile Data Browser,Optimize data browsing for mobile devices,Task
Open Data,Developer Community,Developer Engagement,Engage developer community through hackathons,Task
Open Data,Developer Community,API Support Forum,Launch developer support forum and documentation,Task
Open Data,Developer Community,App Showcase,Showcase applications built using open data,Feature
Open Data,Developer Community,Partnership Program,Establish partnerships with civic tech organizations,Task
Open Data,Public Launch Campaign,Open Data Policy,Publish formal open data policy and principles,Documentation
Open Data,Public Launch Campaign,Portal Launch Event,Host public launch event and media outreach,Task
Open Data,Public Launch Campaign,Citizen Engagement,Conduct citizen engagement to identify priority datasets,Task
Open Data,Public Launch Campaign,Usage Analytics,Implement analytics to track dataset downloads and API usage,Task